{
 "schema_version": 1,
 "id": "veritasium-internet",
 "title": "The Absurd Engineering Behind the Internet",
 "creator": "Veritasium",
 "source": {
  "platform": "youtube",
  "url": null,
  "owner_supplied_file": true
 },
 "kind": "science_documentary",
 "picked_by_owner": true,
 "used_for": [
  "AVEN"
 ],
 "format": {
  "duration_s": 2071.9,
  "width": null,
  "height": null,
  "fps": 23.976023976023978,
  "excerpt": "sync: 0-60 s; motion: whole film"
 },
 "studied": "2026-10-20",
 "tools": [
  "style_intel.avsync",
  "style_intel.motion"
 ],
 "measurements": {
  "picture": {
   "tool": "style_intel.motion",
   "duration_s": 2071.9,
   "transitions_per_min": 13.8,
   "transitions": {
    "hard_cut": 408,
    "dissolve": 38,
    "dip_to_black": 3,
    "wipe": 6,
    "cut_on_pan": 7,
    "match_cut": 12,
    "cut_on_zoom": 4
   },
   "gradual_median_frames": {
    "dissolve": 8.5,
    "dip_to_black": 25.0,
    "wipe": 5.5
   },
   "camera": {
    "pan": 94,
    "push_in": 149,
    "locked": 186,
    "pull_out": 83,
    "too_short": 14
   },
   "easing": {
    "linear": 126,
    "ease_out_strong": 47,
    "ease_in": 54,
    "ease_in_out": 46,
    "ease_out": 53
   },
   "drawing_rate": {
    "ones": 143,
    "twos": 30,
    "held 4 frames": 5,
    "threes": 4,
    "None": 1,
    "held 7 frames": 1,
    "held 5 frames": 2
   },
   "push_zoom_median": 1.062,
   "move_seconds_median": 3.19,
   "transitions_total": 478
  },
  "sync": {
   "tool": "style_intel.avsync (av_layers)",
   "duration_s": 59.98,
   "strategy": "regional",
   "why": "hats is followed in one part of the picture (around region r0c0; 21% of regions), not by a colour element or the whole image",
   "borderline": [],
   "evidence": {
    "strongest_layer": "hats",
    "spread": 0.21,
    "whole_image_corr": 0.016
   },
   "mapping": {
    "hats": {
     "element": "region r0c0",
     "lag_ms": -83,
     "corr": 0.262,
     "consistency": "intermittent",
     "responded": 0.19,
     "chance_95": 0.095,
     "phrase_level": true
    },
    "snare": {
     "element": "region r1c1",
     "lag_ms": -42,
     "corr": 0.203,
     "consistency": "intermittent",
     "responded": 0.111,
     "chance_95": 0.074,
     "phrase_level": true
    },
    "kick": {
     "element": "region r2c1",
     "lag_ms": -42,
     "corr": 0.107,
     "consistency": "intermittent",
     "responded": 0.086,
     "chance_95": 0.062,
     "phrase_level": true
    }
   },
   "grid": {
    "events": 19,
    "beat_period_ms": 542,
    "beat": {
     "locked": false,
     "R": 0.112,
     "chance_95": 0.38,
     "low_confidence": false,
     "mean_offset_ms": -91,
     "share_within_10pct": 0.26
    },
    "bar": {
     "locked": false,
     "R": 0.22,
     "chance_95": 0.38,
     "low_confidence": false,
     "mean_offset_ms": -45,
     "share_within_10pct": 0.26
    }
   },
   "camera": {
    "median_speed_px": 0.77,
    "tracking_agreement": 1.0,
    "moving": true,
    "speed_vs_energy": {
     "corr": -0.166,
     "chance_95": 0.163,
     "follows": false
    },
    "speed_vs_rhythm_per_bar": {
     "corr": -0.31,
     "chance_95": 0.356,
     "follows": false
    },
    "accelerations_on_grid": {
     "events": 20,
     "beat_period_ms": 542,
     "beat": {
      "locked": false,
      "R": 0.267,
      "chance_95": 0.382,
      "low_confidence": false,
      "mean_offset_ms": -66,
      "share_within_10pct": 0.3
     },
     "bar": {
      "locked": false,
      "R": 0.094,
      "chance_95": 0.386,
      "low_confidence": false,
      "mean_offset_ms": -8,
      "share_within_10pct": 0.32
     }
    }
   },
   "tempo_bpm": 110.6,
   "layers": {
    "kick": "81 hits",
    "snare": "27 hits",
    "hats": "21 hits",
    "bass": "64 hits",
    "melody": "107 hits",
    "vocals": "123 hits"
   },
   "uncertainty": [
    "layers from Demucs stems (htdemucs)",
    "snare and hats hit together (r=0.82): an element following one also follows the other; the mapping names the stronger, not proven the cause",
    "how the sync was made (a shared note list, or audio analysed after rendering) cannot be seen in the finished video"
   ]
  }
 },
 "observations": [
  "OBSERVED: the owner takes ONLY its 2D animation for AVEN; painted characters drawn on twos"
 ],
 "labels": "MEASURED = a tool's number (the tool is named); OBSERVED = seen on frames by a person or Claude; INFERRED = reasoning from the evidence. Watcher descriptions are never evidence.",
 "findings_doc": null,
 "local_data": "analysis/internet"
}
